{
  "$schema": "https://raw.githubusercontent.com/iamngoni/kanso-themes/main/schema/kanso-theme-v1.json",
  "schema_version": 1,
  "name": "Nordfox",
  "author": "EdenEast",
  "license": "MIT",
  "source": "https://github.com/EdenEast/nightfox.nvim",
  "description": "Nordfox: the cool blue-grey of Nord, through Nightfox's eyes.",
  "appearance": "dark",
  "ui": {
    "editor": "#2E3440",
    "text": "#CDCECF",
    "accent": "#7AD4D6",
    "app": "#2E3440",
    "sidebar": "#2E3440",
    "list": "#2E3440",
    "elevated": "#2E3440",
    "fill": "#2D5C5D",
    "text_secondary": "#A2A4A8",
    "text_muted": "#7E8188",
    "divider": "#39404F",
    "link": "#7AD4D6",
    "row_active": "#29394E",
    "row_hover": "#2C3646",
    "sidebar_active": "#29394E",
    "sidebar_hover": "#2C3646",
    "hover": "#2C3646",
    "selected": "#29394E",
    "active_line": "#29394E",
    "warning": "#938568",
    "danger": "#9B757C",
    "selection": "#7AD4D618"
  },
  "syntax": {
    "block_marker": "#AEAFB0",
    "marker": "#AEAFB0",
    "list_marker": "#AEAFB0",
    "code": "#A3BE8C",
    "code_block": "#A3BE8C",
    "escape": "#A3BE8C",
    "comment": "#747F8E",
    "comment_doc": "#747F8E",
    "keyword": "#FB94FF",
    "string": "#A3BE8C",
    "string_special": "#A3BE8C",
    "function": "#86ABDC",
    "type": "#F4A261",
    "type_constructor": "#BAA1E2",
    "number": "#F4A261",
    "constant": "#F4A261",
    "variable": "#D6D6D7",
    "variable_special": "#D6D6D7",
    "property": "#9EFFFF",
    "tag": "#BAA1E2",
    "operator": "#9D79D6",
    "punctuation": "#AEAFB0",
    "bracket": "#AEAFB0"
  },
  "preview": {
    "code_background": "#2D5C5D",
    "selection": "#7AD4D640"
  }
}
