{
  "$schema": "https://raw.githubusercontent.com/iamngoni/kanso-themes/main/schema/kanso-theme-v1.json",
  "schema_version": 1,
  "name": "Everforest Light",
  "author": "sainnhe",
  "license": "MIT",
  "source": "https://github.com/sainnhe/everforest",
  "description": "Everforest in daylight: paper the color of old leaves, with forest greens.",
  "appearance": "light",
  "ui": {
    "editor": "#FDF6E3",
    "text": "#5A676F",
    "accent": "#8DA101",
    "app": "#EFEBD4",
    "sidebar": "#F4F0D9",
    "list": "#F4F0D9",
    "elevated": "#F4F0D9",
    "fill": "#F4F0D9",
    "text_secondary": "#7C8884",
    "text_muted": "#808C86",
    "divider": "#F4F0D9",
    "link": "#57707E",
    "row_active": "#ECE9D4",
    "row_hover": "#F0F1D2",
    "sidebar_active": "#ECE9D4",
    "sidebar_hover": "#F0F1D2",
    "hover": "#F0F1D2",
    "selected": "#EFEBD4",
    "active_line": "#F4F0D9",
    "success": "#809220",
    "warning": "#A18636",
    "danger": "#EC5754",
    "selection": "#8DA10130",
    "caret": "#E36868"
  },
  "syntax": {
    "heading": "#D27836",
    "block_marker": "#3A94C5",
    "marker": "#869289",
    "list_marker": "#3A94C5",
    "link": "#AA892C",
    "url": "#3A94C5",
    "code": "#849714",
    "code_block": "#849714",
    "emphasis": {
      "color": "#3A9F7A",
      "font_style": "italic"
    },
    "strong": {
      "color": "#3A9F7A",
      "font_weight": 600
    },
    "front_matter": "#D269B3",
    "escape": "#849714",
    "comment": "#869289",
    "comment_doc": "#829181",
    "keyword": "#F85552",
    "string": "#3A9F7A",
    "string_special": "#849714",
    "function": "#849714",
    "type": "#AA892C",
    "type_constructor": "#849714",
    "number": "#D269B3",
    "boolean": "#D269B3",
    "constant": "#5C6A72",
    "variable": "#5C6A72",
    "variable_special": "#D269B3",
    "property": "#3A94C5",
    "attribute": "#D269B3",
    "tag": "#D27836",
    "label": "#D27836",
    "operator": "#D27836",
    "punctuation": "#869289",
    "bracket": "#5C6A72",
    "embedded": "#849714"
  },
  "preview": {
    "quote": "#677377",
    "selection": "#8DA10134"
  }
}
