{
  "$schema": "https://raw.githubusercontent.com/iamngoni/kanso-themes/main/schema/kanso-theme-v1.json",
  "schema_version": 1,
  "name": "Kanso Dark",
  "author": "Kanso",
  "license": "MIT",
  "source": "https://github.com/iamngoni/kanso",
  "description": "Warm graphite: Kanso's own dark theme.",
  "appearance": "dark",
  "ui": {
    "editor": "#282824",
    "text": "#F1EFE7",
    "accent": "#7E96B3",
    "app": "#181816",
    "sidebar": "#1D1D1A",
    "list": "#232320",
    "elevated": "#30302B",
    "fill": "#30302B",
    "text_secondary": "#B7B3A8",
    "text_muted": "#7E7A70",
    "divider": "#3A3933",
    "link": "#869DB9",
    "row_active": "#30302B",
    "row_hover": "#2A2A26",
    "sidebar_active": "#2E2E2A",
    "sidebar_hover": "#252522",
    "hover": "#3A3933",
    "selected": "#3A3933",
    "active_line": "#2D2D29",
    "button": "#4A6385",
    "button_text": "#F1EFE7",
    "success": "#7BAA78",
    "warning": "#C49A5A",
    "danger": "#C96E63"
  },
  "syntax": {
    "text": "#F1EFE7",
    "heading": {
      "color": "#F1EFE7",
      "font_weight": 700
    },
    "block_marker": "#7E7A70",
    "marker": "#7E7A70",
    "list_marker": "#7E7A70",
    "task": "#7E7A70",
    "hr": "#7E7A70",
    "link": "#869DB9",
    "url": "#7E7A70",
    "code": "#CDB892",
    "code_block": "#B7B3A8",
    "emphasis": {
      "font_style": "italic"
    },
    "strong": {
      "font_weight": 700
    },
    "escape": "#7E7A70",
    "comment": {
      "color": "#7E7A70",
      "font_style": "italic"
    },
    "comment_doc": {
      "color": "#7E7A70",
      "font_style": "italic"
    },
    "keyword": "#8FB0D9",
    "string": "#A8C98A",
    "string_special": "#A8C98A",
    "function": "#E6C68E",
    "type": "#8EC5B8",
    "type_constructor": "#8FB0D9",
    "number": "#E0A882",
    "boolean": "#E0A882",
    "constant": "#E0A882",
    "variable": "#F1EFE7",
    "variable_special": "#E0A882",
    "property": "#DAD6CB",
    "attribute": "#C3A6D6",
    "tag": "#8FB0D9",
    "label": "#C3A6D6",
    "operator": "#A29E94",
    "punctuation": "#A29E94",
    "bracket": "#A29E94",
    "embedded": "#F1EFE7"
  },
  "preview": {
    "code_background": "#30302B"
  }
}
