{
  "$schema": "https://raw.githubusercontent.com/iamngoni/kanso-themes/main/schema/kanso-theme-v1.json",
  "schema_version": 1,
  "name": "Dayfox",
  "author": "EdenEast",
  "license": "MIT",
  "source": "https://github.com/EdenEast/nightfox.nvim",
  "description": "Dayfox: warm linen paper with deep, inky blues and violets.",
  "appearance": "light",
  "ui": {
    "editor": "#F6F2EE",
    "text": "#3D2B5A",
    "accent": "#236A70",
    "app": "#E4DCD4",
    "sidebar": "#F6F2EE",
    "list": "#F6F2EE",
    "elevated": "#E4DCD4",
    "fill": "#DBD1DD",
    "text_secondary": "#643F61",
    "text_muted": "#824D5B",
    "divider": "#DBD1DD",
    "link": "#236A70",
    "row_active": "#D3C7BB",
    "row_hover": "#DBD1DD",
    "sidebar_active": "#D3C7BB",
    "sidebar_hover": "#DBD1DD",
    "hover": "#DBD1DD",
    "selected": "#D3C7BB",
    "active_line": "#DBD1DD",
    "button": "#2848A9",
    "button_text": "#FFFFFF",
    "success": "#396847",
    "warning": "#AC5402",
    "danger": "#A5222F",
    "selection": "#E7D2BE",
    "caret": "#3D2B5A"
  },
  "syntax": {
    "text": "#3D2B5A",
    "heading": {
      "color": "#223D90",
      "font_weight": 700
    },
    "block_marker": "#6E33CE",
    "marker": "#643F61",
    "list_marker": "#643F61",
    "task": "#223D90",
    "hr": "#837A72",
    "quote": {
      "color": "#643F61",
      "font_style": "italic"
    },
    "link": "#223D90",
    "url": "#287980",
    "code": "#396847",
    "code_block": "#396847",
    "emphasis": {
      "color": "#302B5D",
      "font_style": "italic"
    },
    "strong": {
      "color": "#302B5D",
      "font_weight": 700
    },
    "front_matter": "#837A72",
    "html": "#8B369A",
    "escape": "#924702",
    "comment": "#837A72",
    "comment_doc": "#837A72",
    "keyword": "#6E33CE",
    "string": "#396847",
    "string_special": "#924702",
    "function": "#223D90",
    "type": "#AC5402",
    "type_constructor": "#5E2BAF",
    "number": "#955F61",
    "boolean": "#7F5152",
    "constant": "#7F5152",
    "variable": "#352C24",
    "variable_special": "#A5222F",
    "property": "#2848A9",
    "attribute": "#7F5152",
    "tag": "#5E2BAF",
    "label": "#5E2BAF",
    "operator": "#643F61",
    "punctuation": "#643F61",
    "bracket": "#643F61",
    "embedded": "#287980"
  },
  "preview": {
    "text": "#3D2B5A",
    "heading": "#223D90",
    "link": "#223D90",
    "quote": "#643F61",
    "task_done": "#824D5B",
    "border": "#AAB0AD",
    "code_background": "#E4DCD4",
    "code_text": "#376545",
    "inline_code_background": "#DBD1DD",
    "inline_code_text": "#376545",
    "table_header_background": "#DBD1DD",
    "selection": "#E7D2BE"
  }
}
