{
  "$schema": "https://raw.githubusercontent.com/iamngoni/kanso-themes/main/schema/kanso-theme-v1.json",
  "schema_version": 1,
  "name": "Carbonfox",
  "author": "EdenEast",
  "license": "MIT",
  "source": "https://github.com/EdenEast/nightfox.nvim",
  "description": "Carbonfox: near-black carbon with bright, electric pinks and blues.",
  "appearance": "dark",
  "ui": {
    "editor": "#161616",
    "text": "#F2F4F8",
    "accent": "#52BDFF",
    "app": "#0C0C0C",
    "sidebar": "#161616",
    "list": "#161616",
    "elevated": "#0C0C0C",
    "fill": "#252525",
    "text_secondary": "#B6B8BB",
    "text_muted": "#7B7C7E",
    "divider": "#252525",
    "link": "#52BDFF",
    "row_active": "#353535",
    "row_hover": "#252525",
    "sidebar_active": "#353535",
    "sidebar_hover": "#252525",
    "hover": "#252525",
    "selected": "#353535",
    "active_line": "#353535",
    "button": "#78A9FF",
    "button_text": "#161616",
    "success": "#25BE6A",
    "warning": "#08BDBA",
    "danger": "#EE5396",
    "selection": "#2A2A2A",
    "caret": "#F2F4F8"
  },
  "syntax": {
    "text": "#F2F4F8",
    "heading": {
      "color": "#8CB6FF",
      "font_weight": 700
    },
    "block_marker": "#BE95FF",
    "marker": "#B6B8BB",
    "list_marker": "#B6B8BB",
    "task": "#8CB6FF",
    "hr": "#6E6F70",
    "quote": {
      "color": "#B6B8BB",
      "font_style": "italic"
    },
    "link": "#8CB6FF",
    "url": "#33B1FF",
    "code": "#25BE6A",
    "code_block": "#25BE6A",
    "emphasis": {
      "color": "#F9FBFF",
      "font_style": "italic"
    },
    "strong": {
      "color": "#F9FBFF",
      "font_weight": 700
    },
    "front_matter": "#6E6F70",
    "html": "#FF91C1",
    "escape": "#2DC7C4",
    "comment": "#6E6F70",
    "comment_doc": "#6E6F70",
    "keyword": "#BE95FF",
    "string": "#25BE6A",
    "string_special": "#2DC7C4",
    "function": "#8CB6FF",
    "type": "#08BDBA",
    "type_constructor": "#C8A5FF",
    "number": "#3DDBD9",
    "boolean": "#5AE0DF",
    "constant": "#5AE0DF",
    "variable": "#DFDFE0",
    "variable_special": "#EE5396",
    "property": "#78A9FF",
    "attribute": "#5AE0DF",
    "tag": "#C8A5FF",
    "label": "#C8A5FF",
    "operator": "#B6B8BB",
    "punctuation": "#B6B8BB",
    "bracket": "#B6B8BB",
    "embedded": "#33B1FF"
  },
  "preview": {
    "text": "#F2F4F8",
    "heading": "#8CB6FF",
    "link": "#8CB6FF",
    "quote": "#B6B8BB",
    "task_done": "#7B7C7E",
    "border": "#353535",
    "code_background": "#0C0C0C",
    "code_text": "#25BE6A",
    "inline_code_background": "#252525",
    "inline_code_text": "#25BE6A",
    "table_header_background": "#252525",
    "selection": "#2A2A2A"
  }
}
