{
  "$schema": "https://raw.githubusercontent.com/iamngoni/kanso-themes/main/schema/kanso-theme-v1.json",
  "schema_version": 1,
  "name": "Duskfox",
  "author": "EdenEast",
  "license": "MIT",
  "source": "https://github.com/EdenEast/nightfox.nvim",
  "description": "Duskfox: Nightfox at dusk, in muted lavender and rose.",
  "appearance": "dark",
  "ui": {
    "editor": "#232136",
    "text": "#E0DEF4",
    "accent": "#7AD4D6",
    "app": "#232136",
    "sidebar": "#232136",
    "list": "#232136",
    "elevated": "#232136",
    "fill": "#346C6D",
    "text_secondary": "#B8B5CE",
    "text_muted": "#6E6A86",
    "divider": "#2D2A45",
    "link": "#7AD4D6",
    "row_active": "#29394E",
    "row_hover": "#262C41",
    "sidebar_active": "#29394E",
    "sidebar_hover": "#262C41",
    "hover": "#262C41",
    "selected": "#29394E",
    "active_line": "#29394E",
    "warning": "#947659",
    "danger": "#9E5774"
  },
  "syntax": {
    "block_marker": "#AEAFB0",
    "marker": "#AEAFB0",
    "list_marker": "#AEAFB0",
    "code": "#A3BE8C",
    "code_block": "#A3BE8C",
    "escape": "#A3BE8C",
    "comment": "#606E83",
    "comment_doc": "#606E83",
    "keyword": "#FB94FF",
    "string": "#A3BE8C",
    "string_special": "#A3BE8C",
    "function": "#86ABDC",
    "type": "#F4A261",
    "type_constructor": "#BAA1E2",
    "number": "#F4A261",
    "constant": "#F4A261",
    "variable": "#D6D6D7",
    "variable_special": "#D6D6D7",
    "property": "#9EFFFF",
    "tag": "#BAA1E2",
    "operator": "#9D79D6",
    "punctuation": "#AEAFB0",
    "bracket": "#AEAFB0"
  },
  "preview": {
    "code_background": "#346C6D"
  }
}
