{
  "$schema": "https://raw.githubusercontent.com/iamngoni/kanso-themes/main/schema/kanso-theme-v1.json",
  "schema_version": 1,
  "name": "Everforest Dark",
  "author": "sainnhe",
  "license": "MIT",
  "source": "https://github.com/sainnhe/everforest",
  "description": "Sainnhe's Everforest: a forest at dusk, in mossy greens and warm cream.",
  "appearance": "dark",
  "ui": {
    "editor": "#2D353B",
    "text": "#D3C6AA",
    "accent": "#A7C080",
    "app": "#3D484D",
    "sidebar": "#343F44",
    "list": "#343F44",
    "elevated": "#343F44",
    "fill": "#343F44",
    "text_secondary": "#959C90",
    "text_muted": "#859289",
    "divider": "#343F44",
    "link": "#7FBBB3",
    "row_active": "#3D484D",
    "row_hover": "#425047",
    "sidebar_active": "#3D484D",
    "sidebar_hover": "#425047",
    "hover": "#425047",
    "selected": "#3D484D",
    "active_line": "#343F44",
    "success": "#A7C080",
    "warning": "#DBBC7F",
    "danger": "#E67E80",
    "selection": "#543A48",
    "caret": "#E67E80"
  },
  "syntax": {
    "heading": "#E69875",
    "block_marker": "#7FBBB3",
    "marker": "#859289",
    "list_marker": "#7FBBB3",
    "link": "#DBBC7F",
    "url": "#7FBBB3",
    "code": "#A7C080",
    "code_block": "#A7C080",
    "emphasis": {
      "color": "#83C092",
      "font_style": "italic"
    },
    "strong": {
      "color": "#83C092",
      "font_weight": 600
    },
    "front_matter": "#D699B6",
    "escape": "#A7C080",
    "comment": "#859289",
    "comment_doc": "#9DA9A0",
    "keyword": "#E67E80",
    "string": "#83C092",
    "string_special": "#A7C080",
    "function": "#A7C080",
    "type": "#DBBC7F",
    "type_constructor": "#A7C080",
    "number": "#D699B6",
    "boolean": "#D699B6",
    "constant": "#D3C6AA",
    "variable": "#D3C6AA",
    "variable_special": "#D699B6",
    "property": "#7FBBB3",
    "attribute": "#D699B6",
    "tag": "#E69875",
    "label": "#E69875",
    "operator": "#E69875",
    "punctuation": "#859289",
    "bracket": "#D3C6AA",
    "embedded": "#A7C080"
  },
  "preview": {
    "quote": "#989E91",
    "selection": "#A7C0803C"
  }
}
