{
  "$schema": "https://raw.githubusercontent.com/iamngoni/kanso-themes/main/schema/kanso-theme-v1.json",
  "schema_version": 1,
  "name": "Tomorrow Night",
  "author": "Chris Kempson",
  "license": "MIT",
  "source": "https://github.com/chriskempson/tomorrow-theme",
  "description": "Tomorrow Night: a soft charcoal page and muted, familiar accents.",
  "appearance": "dark",
  "ui": {
    "editor": "#1E1F21",
    "text": "#C5C8C6",
    "accent": "#F0C674",
    "app": "#1E1F21",
    "sidebar": "#17181A",
    "list": "#17181A",
    "elevated": "#17181A",
    "text_secondary": "#999A9A",
    "text_muted": "#6A6A6C",
    "divider": "#1C1D1F",
    "row_active": "#2F3237",
    "row_hover": "#252629",
    "sidebar_active": "#282A2E",
    "sidebar_hover": "#1C1E20",
    "hover": "#1C1E20",
    "selected": "#282A2E",
    "active_line": "#2B2D31",
    "success": "#B5BD68",
    "warning": "#F0C674",
    "danger": "#CC6666",
    "selection": "#373B41C0",
    "caret": "#8ABEB7"
  },
  "syntax": {
    "heading": "#B294BB",
    "block_marker": "#C5C8C6",
    "marker": "#C5C8C6",
    "list_marker": "#DE935F",
    "comment": "#969896",
    "keyword": "#B294BB",
    "string": "#B5BD68",
    "function": "#85B7B1",
    "type": "#DE935F",
    "number": "#DE935F",
    "boolean": "#DE935F",
    "constant": "#DE935F",
    "variable": "#C5C8C6",
    "property": "#C5C8C6",
    "tag": "#92B2CA",
    "operator": "#C5C8C6",
    "punctuation": "#C5C8C6",
    "bracket": "#C5C8C6"
  },
  "preview": {}
}
